{
  "$schema": "./microsoft-first-party-appids.schema.json",
  "version": "1.1.0",
  "lastUpdated": "2026-04-30",
  "purpose": "Allowlist of known Microsoft first-party application IDs (AppIds) and owner-tenant GUIDs. Consumed by ENTRA-ENTAPP-020 (Foreign Apps Impersonating Microsoft Names) to avoid false-positives on legitimate Microsoft-published service principals.",
  "sources": [
    {
      "url": "https://learn.microsoft.com/en-us/power-platform/admin/apps-to-allow",
      "title": "Microsoft Learn — Commonly used Microsoft first-party services and portal apps (Power Platform admin)",
      "accessedDate": "2026-04-30",
      "note": "Microsoft-maintained canonical list. Updated by Microsoft as new first-party apps are released."
    }
  ],
  "ownerTenantIds": [
    {
      "id": "f8cdef31-a31e-4b4a-93e4-5f571e91255a",
      "name": "Microsoft Services",
      "purpose": "Most M365 / Office service principals are published from this tenant. The historically-canonical Microsoft owner tenant.",
      "knownExamples": ["Microsoft Teams", "Microsoft SharePoint", "Microsoft Exchange Online"]
    },
    {
      "id": "72f988bf-86f1-41af-91ab-2d7cd011db47",
      "name": "Microsoft Corp",
      "purpose": "Microsoft's primary corporate tenant. Some developer tools and MSAL test apps publish from here.",
      "knownExamples": ["MSAL test apps", "various dev/test SPs"]
    },
    {
      "id": "ea8a4392-515e-481f-879e-6571ff2a8a36",
      "name": "Microsoft (Defender / security narrower)",
      "purpose": "Some Defender-flavored and security-product service principals appear under this owner tenant.",
      "knownExamples": ["specific Defender SPs"]
    },
    {
      "id": "cdc5aeea-15c5-4db6-b079-fcadd2505dc2",
      "name": "Microsoft Graph Command Line Tools",
      "purpose": "Dedicated tenant for the Microsoft Graph PowerShell SDK / Graph CLI tooling. The Connect-MgGraph SP appears here.",
      "knownExamples": ["Microsoft Graph Command Line Tools (14d82eec-204b-4c2f-b7e8-296a70dab67e)"]
    }
  ],
  "appIds": [
    { "appId": "00000007-0000-0000-c000-000000000000", "name": "Dataverse" },
    { "appId": "065d9450-1e87-434e-ac2f-69af271549ed", "name": "PowerPlatformAdminCenter" },
    { "appId": "4e291c71-d680-4d0e-9640-0a3358e31177", "name": "Power Apps" },
    { "appId": "8c1a9936-578e-4d13-9bd9-9afe53ef7de8", "name": "Finance Copilot" },
    { "appId": "d024ca46-2708-4d20-903e-b18b7e1d95dc", "name": "Dynamics365Assistant" },
    { "appId": "61ccfc51-60d1-470a-9dca-f78fcf640d23", "name": "MicrosoftServiceCopilot-Prod" },
    { "appId": "e97edbaf-39b2-4546-ba61-0a24e1bef890", "name": "EHRTeleHealth" },
    { "appId": "7c4f9118-450a-4e75-b96b-df2d0cac4c0d", "name": "d365-dani-exceladdinprod" },
    { "appId": "7f67af8a-fedc-4b08-8b4e-37c4d127b6cf", "name": "Power BI Desktop" },
    { "appId": "871c010f-5e61-4fb1-83ac-98610a7e9110", "name": "MicrosoftPowerBI" },
    { "appId": "8463278f-7a65-4b3d-903c-5e66a2ad1164", "name": "Mix Tools API" },
    { "appId": "5e72ef24-048b-4aae-8fd6-8653ce2d6760", "name": "PowerPlatform-commondataserviceforapps-Connector" },
    { "appId": "d0af0b2c-272b-4820-80ce-af3cc751950f", "name": "sophia.api.microsoft.com" },
    { "appId": "d8fa9ca8-15de-4a33-b719-9c944b9b2e3e", "name": "Sophia Platform Service API" },
    { "appId": "66a88757-258c-4c72-893c-3e8bed4d6899", "name": "QueryFormulationService" },
    { "appId": "325e8307-defd-47df-aeff-15152ea6e5bf", "name": "Prod M365FLWPService Prod" },
    { "appId": "226e4631-c980-4b11-9c96-5e26bb14dafc", "name": "Prod M365FLWPClient Prod" },
    { "appId": "9e6d7425-da52-4c9d-a3bf-48ce4670f9ef", "name": "Prod M365FLWPService FirstRelease" },
    { "appId": "e582717c-581c-4a51-a8d7-5cd28f59497a", "name": "Prod M365FLWPClient FirstRelease" },
    { "appId": "2f29638c-34d4-4cf2-a16a-7caf612cee15", "name": "Microsoft Dynamics CRM for Microsoft Office Outlook" },
    { "appId": "ebf6b2b7-c635-4217-b6b7-21de4ac65764", "name": "WPSTrialSignUpService_Prod" },
    { "appId": "46e9667d-34e6-43d8-a494-6759b3ae6a5e", "name": "Biz Apps Demo Hub Prod" },
    { "appId": "04f0c124-f2bc-4f59-8241-bf6df9866bbd", "name": "Visual Studio" },
    { "appId": "c84a0f23-a0f8-4e8e-918b-57db620d110a", "name": "Power Platform Admin Center Client Test" },
    { "appId": "719640cd-0337-4b0c-8e6a-431271371fab", "name": "make.test.powerapps.com" },
    { "appId": "3e050dd7-7815-46a0-8263-b73168a42c10", "name": "Teams Approvals" },
    { "appId": "08e18876-6177-487e-b8b5-cf950c1e598c", "name": "SharePointOnlineWebClientExtensibility" },
    { "appId": "bee5ee7b-22c7-4e94-9b8b-031319e230a3", "name": "Viva Goals Integrations" },
    { "appId": "6f459c5d-d670-409b-83a6-68b040f4cb78", "name": "Customer Experience Platform FRE PROD" },
    { "appId": "f10573e9-a3c7-41b4-b203-4b1baed8fc8c", "name": "Customer Experience Platform FRE TIP Non-Prod" },
    { "appId": "60f38cf4-a0bf-4fdf-b0b5-14d3131bc031", "name": "make.test.powerapps.com (alt)" },
    { "appId": "a0fe4328-8965-437b-a350-cf71409d002f", "name": "Cloud for Nonprofit Installer" },
    { "appId": "5c17a0cf-5493-4b86-b23d-dabc1cc46f5a", "name": "Minit Desktop for Windows" },
    { "appId": "04d97d71-f71f-450b-8b44-f638d5d1b5d6", "name": "PhysOps.Clients.Worker" },
    { "appId": "2fd908ad-0664-4344-b9be-cd3e8b574c38", "name": "Microsoft.Data.SqlClient" },
    { "appId": "929cb005-cba1-40c4-a962-ef441029cb6c", "name": "make.gov.powerpages.microsoft.us" },
    { "appId": "73a510c3-9946-46dd-b5ae-a8f0ae68fd04", "name": "Azure API Management Portal extension" },
    { "appId": "38ec0b21-8bde-4473-950b-819ceb3ed233", "name": "SuplariDev" },
    { "appId": "ea62c1c6-550b-4238-8ea7-c55a85d86be8", "name": "Teams Work Report" },
    { "appId": "bd414a4d-005a-4a51-a63e-12097e3dcd19", "name": "LobeClientDev" },
    { "appId": "aebc6443-996d-45c2-90f0-388ff96faa56", "name": "Visual Studio Code" },
    { "appId": "4787c7ff-7cea-43db-8d0d-919f15c6354b", "name": "D365SalesProductivityProvisioning" },
    { "appId": "f9a5ac11-cab3-45f0-9d0f-83463ba2e34c", "name": "make.test.powerpages.microsoft.com" },
    { "appId": "75eb2b80-011a-4693-9a47-7971c853603c", "name": "make.powerpages.microsoft.com" },
    { "appId": "a8adde6c-aeb4-4fd6-9d8f-c2dfdecac60a", "name": "Dynamics 365 collaboration with Microsoft Teams" },
    { "appId": "996def3d-b36c-4153-8607-a6fd3c01b89f", "name": "Project Madeira" },
    { "appId": "9cee029c-6210-4654-90bb-17e6e9d36617", "name": "Power Platform CLI - pac" },
    { "appId": "6b91db1b-f05b-405a-a0b2-e3f60b28d645", "name": "M365AdminServices" },
    { "appId": "2f7b4d11-d621-4079-9798-27f548d681f1", "name": "Power Cards" },
    { "appId": "8b66798c-a359-423d-8d71-567ee6da1016", "name": "Dynamics 365 Customer Insights - Consent - DEV" },
    { "appId": "50d9b7e0-07b6-4615-a8ae-f7f017db392a", "name": "Supply Chain Windblade Development" },
    { "appId": "d6037e40-282c-493d-8f63-f255e36c6ef4", "name": "Microsoft Dynamics 365 Supply Chain Visibility" },
    { "appId": "37ff607d-6be1-4c1b-a5f8-e5ad92b55975", "name": "Lobe" },
    { "appId": "22618bd1-b6aa-45f0-8ebd-718d158d888d", "name": "TrustedPublishersProxyService-DoD" },
    { "appId": "e8c38929-689f-4155-96f7-ab45b0f67cec", "name": "TrustedPublishersProxyService-GccModerate" },
    { "appId": "2b61b865-d0bd-4c60-9efa-6fa934eefaac", "name": "TrustedPublishersProxyService" },
    { "appId": "9f4bb91b-347a-47ab-aba4-06db0dcb89e3", "name": "Unify Portal Prod" },
    { "appId": "de490f5e-b798-48d8-ae3b-c220d7494cef", "name": "BAGSolutionsInstaller" },
    { "appId": "9315aedd-209b-43b3-b149-2abff6a95d59", "name": "PowerVirtualAgentsUSGovGCC" },
    { "appId": "fdd7719f-d61e-4592-b501-793734eb8a0e", "name": "SharePointMigrationTool" },
    { "appId": "ef47e344-4bff-4e28-87da-6551a21ffbe0", "name": "BingTest" },
    { "appId": "9ea1ad79-fdb6-4f9a-8bc3-2b70f96e34c7", "name": "Bing" },
    { "appId": "09be0be4-1874-4f49-bc5c-78e6fc2a8065", "name": "Power Apps Portals - Development" },
    { "appId": "386ce8c0-7421-48c9-a1df-2a532400339f", "name": "Power Automate Desktop For Windows" },
    { "appId": "9e3b502c-b4a1-441d-98fd-28e482bf7e88", "name": "Dynamics 365 Customer Insights - Consent" },
    { "appId": "9c60a40b-b5c5-4d01-8588-776209c80db3", "name": "Search Federation Connector - Dataverse" },
    { "appId": "03509b1f-54e9-4557-a555-19a090903b84", "name": "CRM Power BI Integration GCC High" },
    { "appId": "f448d7e5-e313-4f90-a3eb-5dbb3277e4b3", "name": "Media Recording for Dynamics 365 Sales" },
    { "appId": "883d98cb-7d92-43b7-a194-07e51a2fa5bb", "name": "Media Recording for Dynamics 365 Sales - TIP" },
    { "appId": "88c57617-94ff-4043-a396-8a85a8d38922", "name": "Business Central to Common Data Service" },
    { "appId": "19679030-48d8-445f-b27c-311bb3be8a2c", "name": "eSeal" },
    { "appId": "19a92965-3c11-4ed7-a1bd-9b66785dd4c6", "name": "PADWAMigratorGCC" },
    { "appId": "cb47b44e-c0a3-47a5-85ce-3dc039c85e80", "name": "PADWAMigratorGCCHigh" },
    { "appId": "133c4dc0-9d5f-4826-9f7b-6bb3d3867e6a", "name": "PADWAMigrator" },
    { "appId": "8ad75a3e-ae97-457c-baab-65bd5c95389f", "name": "BAGSolutionsInstallerTest" },
    { "appId": "ae7deb89-ca76-4073-bf3e-b72165ac58e9", "name": "Power Automate Desktop DoD" },
    { "appId": "f1a1e36a-d61f-4283-9f48-0867636e332c", "name": "Power Automate Desktop GCC High" },
    { "appId": "041e4c2d-ba3e-46a1-9347-5bc4054c8af4", "name": "Power Automate Desktop GCC" },
    { "appId": "3852314e-aab9-42c3-a859-5b5b88a90000", "name": "ConnectedFieldServiceDeployment" },
    { "appId": "2f6713e6-1e21-4a83-91b4-5bf9a2378f81", "name": "RSOProvisioningCustomerDashboard" },
    { "appId": "257fc75b-c7b8-434b-a467-fcfc16cb7ab6", "name": "Dynamics CRM TIP SRS" },
    { "appId": "a6d2002e-7db6-4da0-94e8-73765fdbc7fb", "name": "ProcessSimpleDoD" },
    { "appId": "ee90a17f-1cb7-4909-be27-dfc2dcc4dc15", "name": "Power Automate Desktop" },